{
  "id": "11111111-1111-1111-1111-111111111111",
  "name": "Baseline Test Session",
  "createdAt": "2026-03-07T20:00:00Z",
  "lastModifiedAt": "2026-03-07T20:00:00Z",
  "bpm": 100,
  "barCount": 4,
  "tracks": [
    {
      "id": "22222222-2222-2222-2222-222222222222",
      "trackType": "midi",
      "instrumentName": "Piano",
      "instrumentProgram": 0,
      "isDrumKit": false,
      "notes": [
        {
          "id": "30000000-0000-0000-0000-000000000001",
          "pitch": 60,
          "velocity": 104,
          "startBeat": 0.0,
          "durationBeats": 1.0
        },
        {
          "id": "30000000-0000-0000-0000-000000000002",
          "pitch": 64,
          "velocity": 102,
          "startBeat": 4.0,
          "durationBeats": 1.0
        },
        {
          "id": "30000000-0000-0000-0000-000000000003",
          "pitch": 67,
          "velocity": 100,
          "startBeat": 8.0,
          "durationBeats": 1.0
        },
        {
          "id": "30000000-0000-0000-0000-000000000004",
          "pitch": 72,
          "velocity": 98,
          "startBeat": 12.0,
          "durationBeats": 1.0
        }
      ],
      "audioFileName": null,
      "recordedAt": "2026-03-07T20:00:00Z",
      "isMuted": false,
      "isSolo": false,
      "volume": 0.8,
      "recordedLengthBeats": 16.0,
      "isLooping": true
    },
    {
      "id": "33333333-3333-3333-3333-333333333333",
      "trackType": "midi",
      "instrumentName": "Drums",
      "instrumentProgram": 0,
      "isDrumKit": true,
      "notes": [
        {
          "id": "30000000-0000-0000-0000-000000000005",
          "pitch": 36,
          "velocity": 120,
          "startBeat": 0.0,
          "durationBeats": 0.25
        },
        {
          "id": "30000000-0000-0000-0000-000000000006",
          "pitch": 42,
          "velocity": 88,
          "startBeat": 0.5,
          "durationBeats": 0.25
        },
        {
          "id": "30000000-0000-0000-0000-000000000007",
          "pitch": 38,
          "velocity": 112,
          "startBeat": 4.0,
          "durationBeats": 0.25
        },
        {
          "id": "30000000-0000-0000-0000-000000000008",
          "pitch": 42,
          "velocity": 88,
          "startBeat": 4.5,
          "durationBeats": 0.25
        },
        {
          "id": "30000000-0000-0000-0000-000000000009",
          "pitch": 36,
          "velocity": 120,
          "startBeat": 8.0,
          "durationBeats": 0.25
        },
        {
          "id": "30000000-0000-0000-0000-000000000010",
          "pitch": 38,
          "velocity": 112,
          "startBeat": 12.0,
          "durationBeats": 0.25
        }
      ],
      "audioFileName": null,
      "recordedAt": "2026-03-07T20:00:00Z",
      "isMuted": true,
      "isSolo": false,
      "volume": 0.55,
      "recordedLengthBeats": 16.0,
      "isLooping": false
    },
    {
      "id": "44444444-4444-4444-4444-444444444444",
      "trackType": "midi",
      "instrumentName": "Bass",
      "instrumentProgram": 32,
      "isDrumKit": false,
      "notes": [
        {
          "id": "30000000-0000-0000-0000-000000000011",
          "pitch": 36,
          "velocity": 96,
          "startBeat": 0.0,
          "durationBeats": 2.0
        },
        {
          "id": "30000000-0000-0000-0000-000000000012",
          "pitch": 36,
          "velocity": 96,
          "startBeat": 4.0,
          "durationBeats": 2.0
        },
        {
          "id": "30000000-0000-0000-0000-000000000013",
          "pitch": 38,
          "velocity": 96,
          "startBeat": 8.0,
          "durationBeats": 2.0
        },
        {
          "id": "30000000-0000-0000-0000-000000000014",
          "pitch": 41,
          "velocity": 96,
          "startBeat": 12.0,
          "durationBeats": 2.0
        }
      ],
      "audioFileName": null,
      "recordedAt": "2026-03-07T20:00:00Z",
      "isMuted": false,
      "isSolo": true,
      "volume": 0.92,
      "recordedLengthBeats": 16.0,
      "isLooping": true
    }
  ]
}
